{
  "$schema": "https://json-schema.org/draft/2020-12/schema",
  "$id": "https://www.3se.info/3se-onto/schemas/term.schema.json",
  "title": "Glossary Term",
  "type": "object",
  "additionalProperties": false,
  "required": [
    "@context",
    "@type",
    "title"
  ],
  "properties": {
    "@context": {
      "type": "string",
      "format": "uri",
      "const": "https://www.3se.info/3se-onto/contexts/term.context.jsonld",
      "description": "JSON-LD context URI. Must reference the canonical context document for this schema."
    },
    "@id": {
      "type": "string",
      "format": "uri",
      "description": "The globally unique IRI identifying this concept as an RDF resource (the RDF subject). Must be an absolute URI. Example: 'https://www.3se.info/3se-onto/terms/load-balancing'."
    },
    "@type": {
      "description": "RDF type declaration. Must include 'skos:Concept'. May additionally include other compatible types (e.g. 'owl:Class').",
      "oneOf": [
        {
          "type": "string",
          "const": "skos:Concept"
        },
        {
          "type": "array",
          "contains": {
            "const": "skos:Concept"
          },
          "items": {
            "type": "string"
          },
          "minItems": 1,
          "uniqueItems": true
        }
      ]
    },
    "title": {
      "type": "string",
      "minLength": 1,
      "description": "skos:prefLabel — The preferred human-readable label for this concept. There MUST be at most one per language tag."
    },
    "description": {
      "type": "string",
      "minLength": 1,
      "description": "skos:definition — A complete explanation of the intended meaning of the concept. Should be a self-contained definition."
    },
    "notes": {
      "type": "string",
      "description": "skos:scopeNote — A note that clarifies the intended use or application scope of the concept. Markdown is supported."
    },
    "aliases": {
      "type": "array",
      "items": {
        "type": "string",
        "minLength": 1
      },
      "uniqueItems": true,
      "description": "skos:altLabel — Alternative labels (synonyms, abbreviations, variant spellings). A string that is an altLabel for one concept MUST NOT be a prefLabel for the same concept."
    },
    "broader": {
      "description": "skos:broader — IRIs of concepts that are more general than this one in the hierarchy. Inverse of skos:narrower.",
      "type": "array",
      "items": {
        "$ref": "#/$defs/conceptRef"
      },
      "uniqueItems": true
    },
    "narrower": {
      "description": "skos:narrower — IRIs of concepts that are more specific than this one in the hierarchy. Inverse of skos:broader.",
      "type": "array",
      "items": {
        "$ref": "#/$defs/conceptRef"
      },
      "uniqueItems": true
    },
    "related": {
      "description": "skos:related — IRIs of concepts that are associatively (non-hierarchically) related to this one. The property is symmetric but not transitive. A concept MUST NOT be skos:related to one of its hierarchical ancestors or descendants.",
      "type": "array",
      "items": {
        "$ref": "#/$defs/conceptRef"
      },
      "uniqueItems": true
    },
    "exactMatch": {
      "description": "skos:exactMatch — IRIs of concepts from other schemes that can be used interchangeably with this one in all contexts. Implies skos:closeMatch.",
      "type": "array",
      "items": {
        "type": "string",
        "format": "uri"
      },
      "uniqueItems": true
    },
    "closeMatch": {
      "description": "skos:closeMatch — IRIs of sufficiently similar concepts from other schemes that can be used interchangeably in some (but not all) contexts.",
      "type": "array",
      "items": {
        "type": "string",
        "format": "uri"
      },
      "uniqueItems": true
    },
    "broadMatch": {
      "description": "skos:broadMatch — IRIs of concepts from other schemes that are more general counterparts of this concept (cross-scheme skos:broader).",
      "type": "array",
      "items": {
        "type": "string",
        "format": "uri"
      },
      "uniqueItems": true
    },
    "narrowMatch": {
      "description": "skos:narrowMatch — IRIs of concepts from other schemes that are more specific counterparts of this concept (cross-scheme skos:narrower).",
      "type": "array",
      "items": {
        "type": "string",
        "format": "uri"
      },
      "uniqueItems": true
    },
    "relatedMatch": {
      "description": "skos:relatedMatch — IRIs of concepts from other schemes that are associatively related to this concept (cross-scheme skos:related).",
      "type": "array",
      "items": {
        "type": "string",
        "format": "uri"
      },
      "uniqueItems": true
    },
    "subClassOf": {
      "description": "rdfs:subClassOf — IRI of the BFO classes that this concept is a subclass of. Used exclusively for formal subsumption under the Basic Formal Ontology (BFO). Every instance of this concept is also an instance of the referenced BFO class.",
      "type": "array",
      "items": {
        "type": "string",
        "format": "uri"
      },
      "minItems": 1,
      "uniqueItems": true
    },
    "semanticRelation": {
      "description": "skos:semanticRelation — Generic semantic relation to another concept in the same scheme. Prefer the more specific sub-properties (broader, narrower, related) whenever possible.",
      "type": "array",
      "items": {
        "$ref": "#/$defs/conceptRef"
      },
      "uniqueItems": true
    },
    "isComposedOf": {
      "description": "3se:isComposedOf — IRIs of concepts that compose an element in a breakdown structure (composition relation).",
      "type": "array",
      "items": {
        "type": "string",
        "format": "uri"
      },
      "uniqueItems": true
    },
    "isVariantOf": {
      "description": "3se:isVariantOf — IRIs of base concepts of which this concept is an alternative (variability relation). Not transitive.",
      "type": "array",
      "items": {
        "type": "string",
        "format": "uri"
      },
      "uniqueItems": true
    },
    "allocates": {
      "description": "3se:allocates — IRIs of concepts that are allocated to elements of a breakdown structure (allocation relation).",
      "type": "array",
      "items": {
        "type": "string",
        "format": "uri"
      },
      "uniqueItems": true
    },
    "isRepresentedBy": {
      "description": "3se:isRepresentedBy — IRIs of concepts that represent elements of a breakdown structure (description relation).",
      "type": "array",
      "items": {
        "type": "string",
        "format": "uri"
      },
      "uniqueItems": true
    },
    "canBe": {
      "description": "3se:canBe — IRIs of concepts that an element of a breakdown structure can be (recursion relation).",
      "type": "array",
      "items": {
        "type": "string",
        "format": "uri"
      },
      "uniqueItems": true
    },
    "exposes": {
      "description": "3se:exposes — IRIs of concepts that an element exposes (exposure relation).",
      "type": "array",
      "items": {
        "type": "string",
        "format": "uri"
      },
      "uniqueItems": true
    },
    "produces": {
      "description": "3se:produces — IRIs of elements that an element produces as output (production relation).",
      "type": "array",
      "items": {
        "type": "string",
        "format": "uri"
      },
      "uniqueItems": true
    },
    "consumes": {
      "description": "3se:consumes — IRIs of elements that an element consumes as input (consumption relation).",
      "type": "array",
      "items": {
        "type": "string",
        "format": "uri"
      },
      "uniqueItems": true
    },
    "conveys": {
      "description": "3se:conveys — IRIs of flows or exchanges that circulate through an interface (conveyance relation).",
      "type": "array",
      "items": {
        "type": "string",
        "format": "uri"
      },
      "uniqueItems": true
    },
    "evaluates": {
      "description": "3se:evaluates — IRIs of elements that an evaluation case was developed to assess (evaluation relation).",
      "type": "array",
      "items": {
        "type": "string",
        "format": "uri"
      },
      "uniqueItems": true
    },
    "fires": {
      "description": "3se:fires — IRIs of transitions that a state can fire (fire relation).",
      "type": "array",
      "items": {
        "type": "string",
        "format": "uri"
      },
      "uniqueItems": true
    },
    "hosts": {
      "description": "3se:hosts — IRIs of physical elements or material entities that a site hosts (hosting relation).",
      "type": "array",
      "items": {
        "type": "string",
        "format": "uri"
      },
      "uniqueItems": true
    },
    "isBoundedBy": {
      "description": "3se:isBoundedBy — IRIs of physical interfaces that (partially or wholly) constitute the boundary of a site (boundary relation).",
      "type": "array",
      "items": {
        "type": "string",
        "format": "uri"
      },
      "uniqueItems": true
    },
    "activates": {
      "description": "3se:activates — IRIs of contexts that a milieu activates by providing the set of actors and systems from which the context emerges (activation relation).",
      "type": "array",
      "items": {
        "type": "string",
        "format": "uri"
      },
      "uniqueItems": true
    },
    "characterizes": {
      "description": "3se:characterizes — IRIs of situations that a state characterizes by specifying the active functions of the entity in that situation (characterization relation).",
      "type": "array",
      "items": {
        "type": "string",
        "format": "uri"
      },
      "uniqueItems": true
    },
    "elicits": {
      "description": "3se:elicits — IRIs of exchanges that an event causally brings about at a system boundary (causal elicitation relation).",
      "type": "array",
      "items": {
        "type": "string",
        "format": "uri"
      },
      "uniqueItems": true
    },
    "frames": {
      "description": "3se:frames — IRIs of situations that a context frames by setting the conditions under which they arise (framing relation).",
      "type": "array",
      "items": {
        "type": "string",
        "format": "uri"
      },
      "uniqueItems": true
    },
    "involves": {
      "description": "3se:involves — IRIs of risks that arise under a situation (involvement relation).",
      "type": "array",
      "items": {
        "type": "string",
        "format": "uri"
      },
      "uniqueItems": true
    },
    "shapes": {
      "description": "3se:shapes — IRIs of milieus that an environment shapes by constraining and enabling what is possible within them (shaping relation).",
      "type": "array",
      "items": {
        "type": "string",
        "format": "uri"
      },
      "uniqueItems": true
    },
    "triggers": {
      "description": "3se:triggers — IRIs of situations that an event triggers by occurring in a context (trigger relation).",
      "type": "array",
      "items": {
        "type": "string",
        "format": "uri"
      },
      "uniqueItems": true
    },
    "denotes": {
      "description": "3se:denotes — IRI of the extensional element that constitutes the extension of this intensional element. Bijective: each intensional element denotes exactly one extensional counterpart, and each extensional counterpart is denoted by exactly one intensional element.",
      "type": "string",
      "format": "uri"
    },
    "isInstantiatedBy": {
      "description": "3se:isInstantiatedBy — IRIs of concrete elements that instantiate this extensional element. Each concrete element satisfies all the constraints of this extensional element.",
      "type": "array",
      "items": {
        "type": "string",
        "format": "uri"
      },
      "uniqueItems": true
    },
    "isAccountableFor": {
      "description": "3se:isAccountableFor — IRIs of concepts for which the element is accountable (association relation).",
      "type": "array",
      "items": {
        "type": "string",
        "format": "uri"
      },
      "uniqueItems": true
    },
    "isResponsibleFor": {
      "description": "3se:isResponsibleFor — IRIs of concepts for which the element is responsible (association relation).",
      "type": "array",
      "items": {
        "type": "string",
        "format": "uri"
      },
      "uniqueItems": true
    },
    "isSupporting": {
      "description": "3se:isSupporting — IRIs of concepts that the element is supporting (association relation).",
      "type": "array",
      "items": {
        "type": "string",
        "format": "uri"
      },
      "uniqueItems": true
    },
    "isReferencedBy": {
      "description": "dcterms:isReferencedBy — IRIs of bibliographic resources (bibo:Document) that cite or reference this concept.",
      "type": "array",
      "items": {
        "type": "string",
        "format": "uri"
      },
      "uniqueItems": true
    },
    "in_scheme": {
      "type": "string",
      "format": "uri",
      "description": "skos:inScheme — The IRI of the skos:ConceptScheme this concept belongs to. A concept may belong to more than one scheme."
    },
    "top_concept_of": {
      "type": "string",
      "format": "uri",
      "description": "skos:topConceptOf — The skos:ConceptScheme IRI for which this concept is a top-level entry point. Implies skos:inScheme."
    },
    "deprecated": {
      "type": "boolean",
      "default": false,
      "description": "owl:deprecated — When true, signals that this concept is obsolete and should no longer be used in new data."
    },
    "superseded_by": {
      "type": "string",
      "format": "uri",
      "description": "dcterms:isReplacedBy — IRI of the concept that supersedes this one when deprecated is true."
    },
    "entryCreated": {
      "type": "string",
      "format": "date",
      "description": "dcterms:created — ISO 8601 date on which this concept entry was first created."
    },
    "entryModified": {
      "type": "string",
      "format": "date",
      "description": "dcterms:modified — ISO 8601 date on which this concept entry was last modified."
    },
    "entryCreator": {
      "description": "dcterms:creator — The agent(s) who originally created this concept entry.",
      "$ref": "#/$defs/agentOrList"
    },
    "entryContributor": {
      "description": "dcterms:contributor — Agent(s) who contributed to this concept entry after its initial creation.",
      "$ref": "#/$defs/agentOrList"
    },
    "status": {
      "type": "string",
      "enum": [
        "draft",
        "under review",
        "reviewed",
        "under approval",
        "approved",
        "standard"
      ],
      "description": "3SE editorial status of this concept entry."
    }
  },
  "$defs": {
    "conceptRef": {
      "description": "A reference to another skos:Concept, expressed as either a bare IRI string or an element with an @id and an optional denormalised label.",
      "oneOf": [
        {
          "type": "string",
          "format": "uri",
          "description": "IRI of the related concept."
        },
        {
          "type": "object",
          "additionalProperties": false,
          "required": [
            "@id"
          ],
          "properties": {
            "@id": {
              "type": "string",
              "format": "uri",
              "description": "IRI of the related concept."
            },
            "prefLabel": {
              "type": "string",
              "description": "Optional denormalised label for display purposes only. The authoritative label is on the referenced concept."
            }
          }
        }
      ]
    },
    "agent": {
      "description": "A foaf:Agent — a person, organisation, or software agent.",
      "oneOf": [
        {
          "type": "string",
          "description": "Plain-text name of the agent."
        },
        {
          "type": "object",
          "additionalProperties": false,
          "required": [
            "name"
          ],
          "properties": {
            "@id": {
              "type": "string",
              "format": "uri",
              "description": "IRI of the agent (e.g. ORCID, WebID, GitHub profile URL). Maps to foaf:Agent @id."
            },
            "@type": {
              "type": "string",
              "enum": [
                "foaf:Person",
                "foaf:Organization",
                "foaf:Agent"
              ],
              "default": "foaf:Person"
            },
            "name": {
              "type": "string",
              "minLength": 1,
              "description": "foaf:name — Full name or display name of the agent."
            },
            "mbox": {
              "type": "string",
              "format": "email",
              "description": "foaf:mbox — Email address of the agent."
            }
          }
        }
      ]
    },
    "agentOrList": {
      "oneOf": [
        {
          "$ref": "#/$defs/agent"
        },
        {
          "type": "array",
          "items": {
            "$ref": "#/$defs/agent"
          },
          "minItems": 1,
          "uniqueItems": true
        }
      ]
    }
  }
}
