{
  "@context": "https://www.3se.info/3se-onto/contexts/term.context.jsonld",
  "@type": "skos:Concept",
  "title": "Enabling state - 3SE",
  "description": "State of an enabling system.",
  "status": "draft",
  "subClassOf": [
    "https://www.3se.info/3se-onto/terms/state-3se-069b48ef5d787fea"
  ],
  "allocates": [
    "https://www.3se.info/3se-onto/terms/enabling-system-function-3se-069c06710282799a"
  ],
  "@id": "https://www.3se.info/3se-onto/terms/enabling-state-3se-069e1512f37a7612",
  "related": [
    "https://www.3se.info/3se-onto/terms/enabling-system-3se-069b9d2c8d64720e"
  ],
  "entryCreated": "2026-04-16",
  "entryModified": "2026-05-13",
  "entryCreator": {
    "@type": "foaf:Person",
    "name": "@rcasteran"
  }
}
