{
  "@context": "https://www.3se.info/3se-onto/contexts/term.context.jsonld",
  "@type": "skos:Concept",
  "title": "System interface breakdown structure - 3SE",
  "description": "Breakdown structure of the system interface that supports the system architecture by following the principles below:\n(1) A system interface is composed of at least one system element interface.\n(2) A system element interface allocates a physical interface.\n(3) A system element interface can be a system interface.",
  "status": "draft",
  "@id": "https://www.3se.info/3se-onto/terms/system-interface-breakdown-structure-3se-069cd5b860b47815",
  "subClassOf": [
    "https://www.3se.info/3se-onto/terms/breakdown-structure-3se-069d166fa9037b67"
  ],
  "related": [
    "https://www.3se.info/3se-onto/terms/physical-interface-3se-069bd66fb639714a",
    "https://www.3se.info/3se-onto/terms/system-element-interface-3se-069cd5b860d1741a",
    "https://www.3se.info/3se-onto/terms/system-interface-3se-069bd66fb6547971",
    "https://www.3se.info/3se-onto/terms/system-architecture-3se-069cfe7e566773ac",
    "https://www.3se.info/3se-onto/terms/system-architecture-model-3se-069d3f26ae587442"
  ],
  "entryCreated": "2026-04-01",
  "entryModified": "2026-04-06",
  "entryCreator": {
    "@type": "foaf:Person",
    "name": "@rcasteran"
  }
}
