{
  "@context": "https://www.3se.info/3se-onto/contexts/term.context.jsonld",
  "@type": "skos:Concept",
  "title": "Functional interface attribute - 3SE",
  "description": "Attribute of a functional interface.",
  "status": "draft",
  "subClassOf": [
    "https://www.3se.info/3se-onto/terms/attribute-3se-069b72bee1327dcf"
  ],
  "allocates": [
    "https://www.3se.info/3se-onto/terms/system-non-functional-req-3se-069be64e18a67d6e"
  ]
}
