{
  "@context": "https://www.3se.info/3se-onto/contexts/term.context.jsonld",
  "@type": "skos:Concept",
  "title": "Interdependent system function - 3SE",
  "description": "Function devolved to an interdependent system.",
  "status": "approved",
  "subClassOf": [
    "https://www.3se.info/3se-onto/terms/function-3se-069b48ef5d187435"
  ],
  "produces": [
    "https://www.3se.info/3se-onto/terms/flow-3se-069bc4ea53207933",
    "https://www.3se.info/3se-onto/terms/parameter-flow-3se-06a8df23e0387c43",
    "https://www.3se.info/3se-onto/terms/safety-flow-3se-06a8df23e0427a54",
    "https://www.3se.info/3se-onto/terms/safety-parameter-flow-3se-06a8df23e0597d30"
  ],
  "consumes": [
    "https://www.3se.info/3se-onto/terms/flow-3se-069bc4ea53207933",
    "https://www.3se.info/3se-onto/terms/parameter-flow-3se-06a8df23e0387c43",
    "https://www.3se.info/3se-onto/terms/safety-flow-3se-06a8df23e0427a54",
    "https://www.3se.info/3se-onto/terms/safety-parameter-flow-3se-06a8df23e0597d30"
  ],
  "allocates": [
    "https://www.3se.info/3se-onto/terms/interdependent-system-activity-3se-069fdd89b3c87477"
  ],
  "@id": "https://www.3se.info/3se-onto/terms/interdependent-system-function-3se-069fdd89b3d17bf5",
  "related": [
    "https://www.3se.info/3se-onto/terms/interdependent-system-3se-069c2e3021d47617",
    "https://www.3se.info/3se-onto/terms/interdependent-system-functional-element-3se-069fde073fce78a5"
  ],
  "entryCreated": "2026-05-08",
  "entryModified": "2026-09-11",
  "entryCreator": {
    "@type": "foaf:Person",
    "name": "@rcasteran"
  }
}