{
  "@context": "https://www.3se.info/3se-onto/contexts/term.context.jsonld",
  "@type": "skos:Concept",
  "title": "System function - 3SE",
  "description": "Function of a system.",
  "status": "approved",
  "subClassOf": [
    "https://www.3se.info/3se-onto/terms/function-3se-069b48ef5d187435"
  ],
  "allocates": [
    "https://www.3se.info/3se-onto/terms/system-activity-3se-069b48ef5cd47253",
    "https://www.3se.info/3se-onto/terms/system-functional-req-3se-069be64e189d7ee9",
    "https://www.3se.info/3se-onto/terms/system-function-attribute-3se-069dcf9369c8775d"
  ],
  "@id": "https://www.3se.info/3se-onto/terms/system-function-3se-069be64e18947ea8",
  "produces": [
    "https://www.3se.info/3se-onto/terms/flow-3se-069bc4ea53207933",
    "https://www.3se.info/3se-onto/terms/parameter-flow-3se-06a8df23e0387c43",
    "https://www.3se.info/3se-onto/terms/system-failure-3se-069efaf702f27778",
    "https://www.3se.info/3se-onto/terms/system-weakness-3se-069efaf7031577c5"
  ],
  "consumes": [
    "https://www.3se.info/3se-onto/terms/flow-3se-069bc4ea53207933",
    "https://www.3se.info/3se-onto/terms/parameter-flow-3se-06a8df23e0387c43",
    "https://www.3se.info/3se-onto/terms/safety-flow-3se-06a8df23e0427a54",
    "https://www.3se.info/3se-onto/terms/safety-parameter-flow-3se-06a8df23e0597d30",
    "https://www.3se.info/3se-onto/terms/system-failure-3se-069efaf702f27778",
    "https://www.3se.info/3se-onto/terms/system-weakness-3se-069efaf7031577c5"
  ],
  "related": [
    "https://www.3se.info/3se-onto/terms/system-3se-069b85f238f3792d",
    "https://www.3se.info/3se-onto/terms/functional-element-3se-069b9d2c8d9d7504",
    "https://www.3se.info/3se-onto/terms/system-function-breakdown-structure-3se-069c03f8a3ee7e9d",
    "https://www.3se.info/3se-onto/terms/system-functional-analysis-3se-069b9d2c8d85724b",
    "https://www.3se.info/3se-onto/terms/system-state-breakdown-structure-3se-069c062b365f7e5d",
    "https://www.3se.info/3se-onto/terms/system-req-breakdown-structure-3se-069ee3cda6097bec",
    "https://www.3se.info/3se-onto/terms/functional-interdependent-actor-3se-06a29c4e40187a09",
    "https://www.3se.info/3se-onto/terms/failure-and-effect-analysis-3se-06a42cbd0bd47657",
    "https://www.3se.info/3se-onto/terms/system-activity-variant-3se-06a8873e38137fb6"
  ],
  "isComposedOf": [
    "https://www.3se.info/3se-onto/terms/system-element-function-3se-069c995b151972b2"
  ],
  "entryCreated": "2026-03-21",
  "entryModified": "2026-09-11",
  "entryCreator": {
    "@type": "foaf:Person",
    "name": "@rcasteran"
  }
}