{
  "@context": "https://www.3se.info/3se-onto/contexts/term.context.jsonld",
  "@type": "skos:Concept",
  "title": "Software architecture - 3SE",
  "description": "Analysis of the software to determine what software components are realizing it.",
  "status": "draft",
  "subClassOf": [
    "https://www.3se.info/3se-onto/terms/analysis-3se-069b5a9129c37ebe"
  ]
}
