{
  "@context": "https://www.3se.info/3se-onto/contexts/term.context.jsonld",
  "@type": "skos:Concept",
  "title": "Milieu - 3SE",
  "description": "The broader operational environment surrounding the system of interest, populated by interdependent systems and/or interdependent actors that are neither subordinate to nor in a defined relationship with the system of interest, but whose existence and behavior are consequential to it.",
  "status": "reviewed",
  "@id": "https://www.3se.info/3se-onto/terms/milieu-3se-069c1b6f06a77b34",
  "activates": [
    "https://www.3se.info/3se-onto/terms/context-3se-069c1b6f066d7c1e"
  ],
  "related": [
    "https://www.3se.info/3se-onto/terms/system-3se-069b85f238f3792d",
    "https://www.3se.info/3se-onto/terms/interdependent-actor-3se-069c2e3021be796f",
    "https://www.3se.info/3se-onto/terms/interdependent-system-3se-069c2e3021d47617",
    "https://www.3se.info/3se-onto/terms/interdependence-analysis-3se-069c316c191c7780"
  ],
  "entryCreated": "2026-03-23",
  "entryModified": "2026-10-16",
  "entryCreator": {
    "@type": "foaf:Person",
    "name": "@rcasteran"
  }
}
