{
  "@context": "https://www.3se.info/3se-onto/contexts/term.context.jsonld",
  "@type": "skos:Concept",
  "title": "Abstract model - 3SE",
  "description": "A simplified description of an entity to assist calculations and predictions.",
  "status": "approved",
  "subClassOf": [
    "https://www.3se.info/3se-onto/terms/model-3se-069d3d5560f07cc9"
  ],
  "@id": "https://www.3se.info/3se-onto/terms/abstract-model-3se-069d3d55609a75e1",
  "related": [
    "https://www.3se.info/3se-onto/terms/concrete-model-3se-069d3d5560c77d97",
    "https://www.3se.info/3se-onto/terms/entity-3se-06ad9ee61f8977f7"
  ],
  "entryCreated": "2026-04-06",
  "entryModified": "2026-10-22",
  "entryCreator": {
    "@type": "foaf:Person",
    "name": "@rcasteran"
  }
}
