{
  "@context": "https://www.3se.info/3se-onto/contexts/term.context.jsonld",
  "@type": "skos:Concept",
  "title": "Service mean variant - 3SE",
  "description": "Variant of a service mean.",
  "status": "draft",
  "isVariantOf": [
    "https://www.3se.info/3se-onto/terms/service-mean-3se-069c5aee6a337c05"
  ],
  "canBe": [
    "https://www.3se.info/3se-onto/terms/service-variant-3se"
  ]
}
