{
  "@context": "https://www.3se.info/3se-onto/contexts/term.context.jsonld",
  "@type": "skos:Concept",
  "title": "System element state - 3SE",
  "description": "State of a system element.",
  "status": "draft",
  "subClassOf": [
    "https://www.3se.info/3se-onto/terms/state-3se-069b48ef5d787fea"
  ],
  "allocates": [
    "https://www.3se.info/3se-onto/terms/system-element-function-3se"
  ]
}
