{
  "@context": "https://www.3se.info/3se-onto/contexts/term.context.jsonld",
  "@type": "skos:Concept",
  "title": "Flow attribute - 3SE",
  "description": "Attribute of a flow.",
  "status": "approved",
  "subClassOf": [
    "https://www.3se.info/3se-onto/terms/attribute-3se-069b72bee1327dcf"
  ],
  "allocates": [
    "https://www.3se.info/3se-onto/terms/system-non-functional-req-3se-069be64e18a67d6e"
  ],
  "@id": "https://www.3se.info/3se-onto/terms/flow-attribute-3se-069dcf9369937bc7",
  "entryCreated": "2026-04-13",
  "entryModified": "2026-08-14",
  "entryCreator": {
    "@type": "foaf:Person",
    "name": "@rcasteran"
  },
  "related": [
    "https://www.3se.info/3se-onto/terms/system-req-breakdown-structure-3se-069ee3cda6097bec"
  ]
}