{
  "@context": "https://www.3se.info/3se-onto/contexts/term.context.jsonld",
  "@type": "skos:Concept",
  "title": "Safety risk analysis - 3SE",
  "description": "Risk analysis which is relevant for safety engineering.\nIt includes the following steps:\n(1) Identify the hazards.\n(2) For each hazard, evaluate its severity level.\n(3) Identify the hazardous situations.\n(4) For each hazardous situation, determine the different system activities and their generated hazard.\n(5) For each hazardous situation, evaluate the likelihood of its occurrence.\n(6) For each hazardous situation, evaluate the targeted safety risk level based on its hazard severity and the likelihood of its occurrence.\n(7) For each hazardous situation, decide the safety risk treatment: avoid, reduce, retain or share.\n(8) For each hazardous situation, if the safety risk must be reduced, then identify the safety system functional requirements and/or the safety system non-functional requirements and/or the safety system constraints.\n(9) For each hazardous situation, evaluate the safety residual risk level after treatment.\n(10) For each hazardous situation, determine if the safety risk treatment leads to a threatening situation in the same context.\n",
  "status": "reviewed",
  "subClassOf": [
    "https://www.3se.info/3se-onto/terms/risk-analysis-3se-069bda7c99d17d32"
  ],
  "closeMatch": [
    "https://www.3se.info/3se-onto/terms/hazard-analysis-and-risk-assessment-26262-1-2018-069c1ab34b617437"
  ],
  "@id": "https://www.3se.info/3se-onto/terms/safety-risk-analysis-3se-069c1ab34ba5783e",
  "related": [
    "https://www.3se.info/3se-onto/terms/hazard-3se-069bb0a752de7917",
    "https://www.3se.info/3se-onto/terms/safety-risk-3se-069bdd80b5e478a0",
    "https://www.3se.info/3se-onto/terms/threatening-situation-3se-069c1784758674a5",
    "https://www.3se.info/3se-onto/terms/context-3se-069c1b6f066d7c1e",
    "https://www.3se.info/3se-onto/terms/hazardous-situation-3se-069c1b6f069e7ff8",
    "https://www.3se.info/3se-onto/terms/system-activity-3se-069b48ef5cd47253",
    "https://www.3se.info/3se-onto/terms/residual-risk-3se-069c1469f45f7770",
    "https://www.3se.info/3se-onto/terms/safety-system-constraint-3se-069bdc3120dd749a",
    "https://www.3se.info/3se-onto/terms/safety-system-functional-req-3se-069bdc3120e57dc8",
    "https://www.3se.info/3se-onto/terms/safety-system-non-functional-req-3se-069bdc3120ee7a1c"
  ],
  "entryCreated": "2026-03-23",
  "entryModified": "2026-09-18",
  "entryCreator": {
    "@type": "foaf:Person",
    "name": "@rcasteran"
  }
}