{
  "@context": "https://www.3se.info/3se-onto/contexts/term.context.jsonld",
  "@type": "skos:Concept",
  "title": "Model - 3SE",
  "description": "Representation of an entity or collection of entities that provides the ability to portray, understand or predict the attributes or features of the entity or collection under situations of interest.",
  "status": "approved",
  "closeMatch": [
    "https://www.3se.info/3se-onto/terms/model-24641-2023-069d3d5560e87cde"
  ],
  "@id": "https://www.3se.info/3se-onto/terms/model-3se-069d3d5560f07cc9",
  "related": [
    "https://www.3se.info/3se-onto/terms/attribute-3se-069b72bee1327dcf",
    "https://www.3se.info/3se-onto/terms/feature-3se-069b48ef5d0f7505",
    "https://www.3se.info/3se-onto/terms/situation-3se-069c1b6f06b27ce9",
    "https://www.3se.info/3se-onto/terms/analysis-3se-069b5a9129c37ebe",
    "https://www.3se.info/3se-onto/terms/conceptual-model-3se-069d3d5560bf7635",
    "https://www.3se.info/3se-onto/terms/entity-3se-06ad9ee61f8977f7"
  ],
  "entryCreated": "2026-04-06",
  "entryModified": "2026-10-22",
  "entryCreator": {
    "@type": "foaf:Person",
    "name": "@rcasteran"
  }
}
