{
  "@context": "https://www.3se.info/3se-onto/contexts/term.context.jsonld",
  "@type": "skos:Concept",
  "title": "System element non-functional requirement - 3SE",
  "description": "Non-functional requirement about a system element.",
  "status": "reviewed",
  "subClassOf": [
    "https://www.3se.info/3se-onto/terms/non-functional-req-3se-069b88438059727d",
    "https://www.3se.info/3se-onto/terms/system-element-req-3se-069c3bf771277d2d"
  ],
  "canBe": [
    "https://www.3se.info/3se-onto/terms/system-non-functional-req-3se-069be64e18a67d6e"
  ],
  "@id": "https://www.3se.info/3se-onto/terms/system-element-non-functional-req-3se-069ee425ebbb7edc",
  "related": [
    "https://www.3se.info/3se-onto/terms/system-element-3se-069b85f238fb79eb",
    "https://www.3se.info/3se-onto/terms/system-req-breakdown-structure-3se-069ee3cda6097bec",
    "https://www.3se.info/3se-onto/terms/system-element-non-functional-req-variant-3se-06a8873e3885733f"
  ],
  "entryCreated": "2026-04-26",
  "entryModified": "2026-08-21",
  "entryCreator": {
    "@type": "foaf:Person",
    "name": "@rcasteran"
  }
}
