{
  "@context": "https://www.3se.info/3se-onto/contexts/term.context.jsonld",
  "@type": "skos:Concept",
  "title": "System functional requirement - 3SE",
  "description": "Functional requirement about a system.",
  "status": "approved",
  "subClassOf": [
    "https://www.3se.info/3se-onto/terms/functional-req-3se-069b88438050789a",
    "https://www.3se.info/3se-onto/terms/system-req-3se-069c3bf7714e7351"
  ],
  "@id": "https://www.3se.info/3se-onto/terms/system-functional-req-3se-069be64e189d7ee9",
  "related": [
    "https://www.3se.info/3se-onto/terms/system-3se-069b85f238f3792d",
    "https://www.3se.info/3se-onto/terms/stakeholder-req-breakdown-structure-3se-069da425d0607787",
    "https://www.3se.info/3se-onto/terms/system-req-breakdown-structure-3se-069ee3cda6097bec",
    "https://www.3se.info/3se-onto/terms/system-functional-validation-3se-06a27237d3977414"
  ],
  "isComposedOf": [
    "https://www.3se.info/3se-onto/terms/system-element-functional-req-3se-069ee425ebb17241"
  ],
  "entryCreated": "2026-03-21",
  "entryModified": "2026-08-21",
  "entryCreator": {
    "@type": "foaf:Person",
    "name": "@rcasteran"
  }
}