{
  "@context": "https://www.3se.info/3se-onto/contexts/term.context.jsonld",
  "@type": "skos:Concept",
  "title": "Abstract model - 3SE",
  "description": "A simplified description, especially a mathematical one, of an entity, to assist calculations and predictions.",
  "status": "draft",
  "subClassOf": [
    "https://www.3se.info/3se-onto/terms/model-3se"
  ]
}
