{
  "@context": "https://www.3se.info/3se-onto/contexts/term.context.jsonld",
  "@type": "skos:Concept",
  "title": "Stakeholder requirement analysis - 3SE",
  "description": "Analysis of a feature or an attribute to decide what stakeholder requirements and/or stakeholder constraints are specifying it.",
  "status": "approved",
  "@id": "https://www.3se.info/3se-onto/terms/stakeholder-req-analysis-3se-069b9d2c8df07af5",
  "entryCreated": "2026-03-17",
  "entryModified": "2026-08-14",
  "entryCreator": {
    "@type": "foaf:Person",
    "name": "@rcasteran"
  },
  "subClassOf": [
    "https://www.3se.info/3se-onto/terms/analysis-3se-069b5a9129c37ebe"
  ],
  "related": [
    "https://www.3se.info/3se-onto/terms/stakeholder-req-breakdown-structure-3se-069da425d0607787",
    "https://www.3se.info/3se-onto/terms/attribute-3se-069b72bee1327dcf",
    "https://www.3se.info/3se-onto/terms/feature-3se-069b48ef5d0f7505",
    "https://www.3se.info/3se-onto/terms/stakeholder-req-3se-069da425d07f73e2",
    "https://www.3se.info/3se-onto/terms/stakeholder-req-model-3se-069dce2d73c47476",
    "https://www.3se.info/3se-onto/terms/stakeholder-constraint-3se-069bdc8805087d03"
  ]
}