{
  "@context": "https://www.3se.info/3se-onto/contexts/term.context.jsonld",
  "@type": "skos:Concept",
  "title": "Functional architecture - ISO/IEC/IEEE 24765",
  "description": "Hierarchical arrangement of functions, their internal and external (external to the aggregation itself) functional interfaces and external physical interfaces, their respective functional and performance requirements, and their design constraints.",
  "status": "standard",
  "isReferencedBy": [
    "https://www.3se.info/3se-onto/references/iso-iec-ieee-24765-2017-069a99c8f73d72c2"
  ]
}
