{
  "@context": "https://www.3se.info/3se-onto/contexts/term.context.jsonld",
  "@type": "skos:Concept",
  "title": "Product element variant - 3SE",
  "description": "Variant of a product element.",
  "status": "draft",
  "isVariantOf": [
    "https://www.3se.info/3se-onto/terms/product-element-3se-069c01ba91f77631"
  ],
  "canBe": [
    "https://www.3se.info/3se-onto/terms/product-variant-3se"
  ]
}
