{
  "@context": "https://www.3se.info/3se-onto/contexts/term.context.jsonld",
  "@type": "skos:Concept",
  "title": "Functional element variant - 3SE",
  "description": "Variant of a functional element.",
  "status": "draft",
  "isVariantOf": [
    "https://www.3se.info/3se-onto/terms/functional-element-3se-069b9d2c8d9d7504"
  ],
  "allocates": [
    "https://www.3se.info/3se-onto/terms/system-element-state-3se-069c995b153b7534",
    "https://www.3se.info/3se-onto/terms/system-element-state-variant-3se",
    "https://www.3se.info/3se-onto/terms/functional-element-attribute-3se-069dcf93699c7864",
    "https://www.3se.info/3se-onto/terms/functional-element-attribute-variant-3se"
  ],
  "canBe": [
    "https://www.3se.info/3se-onto/terms/high-level-functional-element-variant-3se"
  ],
  "exposes": [
    "https://www.3se.info/3se-onto/terms/functional-interface-3se-069bc53af258726b",
    "https://www.3se.info/3se-onto/terms/functional-interface-variant-3se"
  ]
}
